type,text
Tweet,Se llama MTG-I1 y es el satélite europeo más potente de Europa. Las primeras vistas de nuestro planeta son sencillamente espectaculares. https://t.co/AKvlqi1loP
Tweet,"Delia Akeley logró su hazaña en solitario. En 1925 inició un viaje de meses de duración, convivió con tribus africanas y superó innumerables peligros. https://t.co/uhLNbwDY14"
Tweet,"El chatbot ya es una aplicación oficial para iPhone, pero no para Android. Si quieres saber cómo instalarla en tu móvil, te explicamos cómo. https://t.co/APWQpJsEbt"
Tweet,"Más de 100 años después de que los científicos usaran datos sísmicos para descubrir el núcleo de la Tierra, la tecnología ha sido aplicada ahora a nuestro vecino planeta rojo. https://t.co/sOHiZyRn78"
Tweet,A partir del 30 de junio no podrán llamarte para venderte algo a no ser que lo hayas solicitado. https://t.co/oIUAABJ0Aa
Tweet,"Uno de los grandes sueños del ser humano es volar, pero la fuerza de la gravedad se empecina en mantenernos pegados a la Tierra. ¿Pero y si hubiera alguna forma de apantallar esa ladina fuerza? https://t.co/wF7YtuzRJI"
Tweet,"Y si lo tiene, pero sabemos que el universo está expandiéndose, ¿dónde exactamente estaría el corazón del cosmos? Resolvemos todas las dudas en este artículo. https://t.co/mDs2rLEEX3"
Tweet,¿Se te ocurren distintas formas útiles para vivir en la Luna? ¿Tienes ideas que crees que harían más fácil la vida en el nuestro satélite na https://t.co/mVt84mBSJu
Tweet,Los astrónomos creen que han encontrado los restos de esas explosiones cósmicas originales. https://t.co/AuivUEnWzK
Tweet,"Alrededor de los agujeros negros supermasivos que ocupan el centro de muchas galaxias se concentran grandes discos de gas y polvo en los que podrían formarse planetas más grandes que la Tierra, tal y como han propuesto investigadores japoneses. Estos ... https://t.co/58Bp2WmuXm"
Tweet,Un grupo de investigadores ha logrado envejecer ratones de forma acelerada. También ha sido capaz de revertir los efectos del envejecimiento. https://t.co/qraOijfyqg
Tweet,"Si llevas tiempo dándole vueltas a un problema y no encuentras solución, quizá lo que dice Harvard te saque del atolladero. https://t.co/X89NaKzOVc"
Tweet,"Como vehículo oficial del evento The Music Station, es la primera vez que el nuevo Bronco se presenta en sociedad y ha servido para acompañar a los artistas y grupos musicales más importantes https://t.co/5qJbIPtOxz"
Tweet,Muchos animales de aspecto terrorífico nunca atacan a los seres humanos ni a otros animales. ¿Sabrías decirnos cuáles? https://t.co/HLQyPCZqim
Tweet,Los científicos creen que las torres de comunicaciones móviles representarían una forma de localizarnos en nuestro vecindario cósmico. https://t.co/ZxWn8HwGqr
Tweet,"El colgante, un diente de ciervo, pertenecía a una mujer del Paleolítico, según han descubierto los investigadores. https://t.co/oCbt10i0Qf"
Tweet,"¿Te imaginas descubrir la fascinante historia de una española olvidada en Trípoli en el siglo XIX? Pues prepárate para sumergirte en la lectura del extracto exclusivo del primer capítulo de 'Últimos días en Trípoli' de Mario Garcés, publicado por ... https://t.co/Ky3ZQXoFhM"
Tweet,"En el cementerio de Viena (Zentralfriedhof), el tercero más grande de Europa, se encuentra una lápida con uno de los epitafios más singulares del mundo entero: se trata de una fórmula. ¿Pero qué significa? https://t.co/UZSDuhMDnp"
Tweet,La astrobiología es una ciencia muy joven y marcadamente interdisciplinar que puede traer un gran beneficio a la comunidad científica y a la sociedad haciéndonos cuestionar el lugar que ocupamos en el universo y en el mundo. https://t.co/Bu3zvpfPTM
Tweet,"El telescopio Hubble fue lanzado al espacio con un terrible defecto que hacía que las imágenes que tomaba estuvieran deformadas y desenfocadas. Te contamos la hazaña que supuso encontrar una solución a este problema y, más difícil todavía, instalarla en... https://t.co/Jrcpv13LB0"
Tweet,"La gama Jeep 4xe al completo (Renegade, Compass, Wrangler y el nuevo Grand Cherokee) representa la evolución completa del 4x4 tradicional y ofrece más diversión, más tecnología, más libertad, más capacidad y más sostenibilidad https://t.co/tTO2TSnFZP"
Tweet,"Confirmado. Los científicos han descubierto que la Luna tiene un núcleo sólido, exactamente como la Tierra. https://t.co/HDULAuZxR1"
Tweet,"Irene de Souza, una mujer que destacó por su nivel educativo, sus ideas vanguardistas, su distanciamiento de las creencias religiosas predominantes y, sobre todo, por su audaz ruptura con los convencionalismos de su época, es la protagonista del ... https://t.co/my6DnoCaDf"
Tweet,Un nuevo estudio afirma que la primera tripulación en ser enviada al planeta rojo deberían ser mujeres porque 'son más eficientes'. https://t.co/Wzbp1nDobA
Tweet,Un equipo de científicos se ha pasado tres semanas midiendo las vibraciones para desentrañar este misterio nocturno. Es posible que la razón te sorprenda. https://t.co/VXseTSaQmt
Tweet,Los científicos han nombrado un nuevo género de mariposas recordando al famoso villano de la Tierra Media. https://t.co/ud247N8Sap
Tweet,"Descubre la historia detrás de una de las fuerzas militares más legendarias de la historia: los Tercios de Flandes, en una entrevista exclusiva con el coordinador del libro Los Tercios de Flandes, recién publicado por la editorial Pinolia. https://t.co/96xLE8McDZ"
Tweet,"¿Para qué servirá este impresionante hito? Permitirá la exploración del pasado bioquímico de la Tierra, con la esperanza de descubrir nuevas moléculas terapéuticas. https://t.co/G2HpYXUxm6"
Tweet,"El balizamiento, mediante 10 biotopos o arrecifes, de la zona protegida en la que se encuentra la primera montaña marina construida con carbonato cálcico, se convertirá en un parque subacuático único en el mundo https://t.co/sIACIC27QI"
Tweet,El primer fósil de Tyrannosaurus rex subastado en Europa alcanzó esta cifra. https://t.co/F7MQOrWY3c
Tweet,¿Sabías que nuestra luna es la quinta más grande del sistema solar? ¿Por qué se llama simplemente 'luna'? Te contamos estas y otras curiosidades más sobre nuestro satélite. https://t.co/wYAsI7ybZT
Tweet,¿Qué organismo regula el estado de conservación de las distintas especies? ¿En qué datos se basa? ¿Cómo se actualiza la lista de especies amenazadas? https://t.co/siV8nA3WDC
Tweet,"Un estudio sueco relaciona los desplazamientos de más de 3 km con varios problemas de salud, entre ellos el sobrepeso. https://t.co/i5Pp36otcC"
Tweet,La 'zona crepuscular' del océano alberga una gran diversidad de organismos y miles de millones de toneladas de materia orgánica. https://t.co/OPZxxflAzr
Tweet,"Coches, aviones y trenes han batido sus propios récords de velocidad, pero ninguno de estos vehículos se acerca siquiera a las vertiginosas velocidades alcanzadas por algunas de las sondas lanzadas para estudiar diferentes rincones del sistema solar o ... https://t.co/MSkXqr7LQj"
Tweet,Las razas modernas desarrolladas en los últimos 150 años tienen cráneos más grandes que los perros antiguos. https://t.co/AztqyY1Nui
Tweet,"El 14 de marzo de 1879 nacía en Ulm (Alemania) Albert Einstein, que ha sido declarado por la revista Time el personaje más importante del siglo XX. https://t.co/1zKtZezZbY"
Tweet,"Aunque los más conocidos son Caín y Abel por el episodio fraticida que protagonizaron, existen indicios de que Adán y Eva pudieron tener muchos más hijos. https://t.co/PqQ3ycmGws"
Tweet,"La humanidad es muy diversa, y aunque compartimos el 99 % del ADN, el 1 % restante encierra todas las diferencias, y un solo genoma de referencia no es suficiente. https://t.co/kB387KzxPP"
Tweet,Se trata de un hallazgo único. El yacimiento de fósiles encontrado en Gales es único y nos ofrece un a mirada a cómo era la vida marina en la Tierra antigua. https://t.co/4B3WSyTB0O
Tweet,"Los principales responsables de esto son el cambio climático, el consumo humano y la sedimentación. https://t.co/X22Ck7SHhl"
Tweet,"Pasteles, champús, recipientes, lubricantes, arma arrojadiza… Posiblemente no haya un alimento más versátil como el fruto del cocotero: es el cerdo del mundo vegetal. https://t.co/Bgvi2N0f18"
Tweet,Un auriga nacido en Hispania se convirtió en la mayor estrella de las carreras de cuadrigas. https://t.co/yHAjAKCuDH
Tweet,Unos astrónomos han determinado cuál es el color del universo promediando toda la luz que emiten las estrellas y galaxias. Y les ha salido que es de color café con leche. https://t.co/AS3cMqJNNP
Tweet,"¿Piensas adoptar un perro? Si alguna vez te has preguntado cómo es el proceso de adopción, desde @adoptak te lo cuentan. https://t.co/3lKLU6UrOj"
Tweet,"Nuestro vecino planeta rojo habría tenido agua líquida hace unos 400.000 años, según sugieren los datos del rover Zhurong. https://t.co/4fo3HmX8Jh"
Tweet,"Ahí estaban. Como si de virus 'polizones' se tratara, los científicos han identificado más de 30.000 nuevos virus. https://t.co/WwNwXi1jKJ"
Tweet,"Aunque comúnmente se considera al tigre el felino más grande del mundo, lo cierto es que ni siquiera es un felino. Y el león tampoco. https://t.co/OxN7FqeJz4"
Tweet,"La ciencia y la tecnología imita muchas técnicas y materiales presentes en la naturaleza, y las hormigas pueden enseñarnos a optimizar los algoritmos para la inteligencia artificial. https://t.co/24znlqV5fB"
Tweet,"Heritage tiene como misión mantener, restaurar y promocionar este ingente patrimonio histórico a través de espacios de exposición, la búsqueda de automóviles clásicos para su rehabilitación y la conservación de objetos y documentos https://t.co/SWVPPypiyi"
Tweet,"El robot posee una nueva ""memoria artificial"" gracias a la cual encuentra objetos extraviados. https://t.co/gvzd6qAIqN"
Tweet,¿Resistirán las religiones de la Tierra un contacto con seres extraterrestres? ¿Seguiremos creyendo en nuestras religiones o nos convertiremos a las de ellos? https://t.co/dN2vQPJgWM
Tweet,"Las ciudades más sucias según la encuesta de satisfacción realizada por la OCU son Palma, Alicante y Sevilla. ¿Cuáles son más limpias? https://t.co/z8xIGxsuZ7"
Tweet,"No es una señal alienígena, sino una prueba enviada desde Marte y capturada por tres telescopios de la Tierra. Puedes ayudar a decodificar el mensaje. https://t.co/9FK1IpdSFo"
Tweet,Un depredador primitivo que vivió en la actual Sudáfrica hace 360 millones de años. https://t.co/eGdKYhc9jq
Tweet,"Una buena higiene bucodental en nuestras mascotas es de vital importancia. Por ello, esclave seguir las recomendaciones y acudir de manera periódica al veterinario. https://t.co/z2sszOfstm"
Tweet,"¿Por qué solo creemos que son los animales superiores los que tienen sentimientos? ¿Es que los insectos no sienten? Por desgracia, hay muy poca investigación al respecto. https://t.co/hw79h99wEO"
Tweet,"Seguro que Google Earth te parece una herramienta súper útil, ¿pues sabías que la start-up estadounidense 'Terradepth' tiene el sueño: cartografiar todo el fondo oceánico?

Imagina poder deslizarte bajo el mar como lo hacemos por las calles del mundo. D... https://t.co/xW6efjFN8H"
Tweet,"Desde Star Trek hasta Marvel, la mayoría de los extraterrestres de la ficción tienen una apariencia más o menos humana, pero si existe vida inteligente ahí fuera, lo más probable es que tenga otro aspecto. https://t.co/8tOxffNxrs"
Tweet,Hay rastros humanos en casi todas partes excepto en islas aisladas y cimas de montañas remotas. https://t.co/X8Bgi28oTH
Tweet,"Las teorías son variadas y apenas tenemos certezas, pero es posible que nuestra capacidad para comunicarnos fuera la clave para dominar el mundo. https://t.co/Hi3xo4tRrI"
Tweet,La NASA muestra en animación los agujeros negros más colosales del universo https://t.co/JJ0fk8Eiq0
Tweet,La superficie de la Tierra es cambiante desde el inicio de los tiempos gracias a su actividad tectónica. Hoy repasamos todos esos grandes movimientos de tierra del pasado. https://t.co/5KqfqNsroN
Tweet,"El A290_β es el primero de los tres modelos del futuro 'Dream Garage' será un deportivo de nueva generación, 100% eléctrico, diseñado para despertar el espíritu de competición y reinventar la deportividad en el día a día https://t.co/26DzbPLJQB"
Tweet,"El paso fundamental que determina la muerte de una estrella es que se detienen las reacciones nucleares porque todo el material susceptible de fusionarse se agota, y el núcleo comienza a enfriarse. https://t.co/GTNiZIzrn5"
Tweet,La teoría geocéntrica postulaba que hasta el Sol giraba alrededor de nuestro planeta junto con los demás astros. https://t.co/piMkCFUH6s
Tweet,"Con su gama 4xe, Jeep demuestra que la 'e' de electrificación, puede ser sinónimo de libertad, polivalencia y cualidades off-road. Todo lo necesario para exprimir a tope las vacaciones https://t.co/OxZvdNFxsH"
Tweet,El agujero negro supermasivo M87* es 6.500 millones de veces más grande que el Sol y este hito podría darnos pistas acerca de cómo se alimentan estos gigantes 'invisibles'. https://t.co/XxIxKfGhBQ
Tweet,Su cuerpo está dividido exactamente por la mitad. Es lo que se conoce como ginandromorfia. ¿Es habitual entre las abejas? https://t.co/mb2HzJbzOk
Tweet,¿Está tu profesión en riesgo de ser sustituida por una inteligencia artificial? Avanza la revolución de las IA. https://t.co/37VBvFoPC6
Tweet,No es ciencia ficción: esta nueva herramienta no invasiva puede traducir pensamientos en palabras escritas. https://t.co/0tzRXR5uiV
Tweet,"""Musulmanes de hoy, integristas vs moderados"" es el título del #podcast de hoy de Grandes Reportajes de Muy Historia ¡dale al play en @ivoox y descubre la historia del Islam! 

👉 No te lo pierdas: https://t.co/Zudej2E1Qb https://t.co/mKrwSOkf09"
Tweet,"¿Te has preguntado alguna vez por qué te enamoras de ciertas personas? Un nuevo estudio ha averiguado la razón por la que lo hacemos. Te lo contamos en este artículo ❤️👇

https://t.co/0SiR1dshmK"
Tweet,"Echa un ojo al cielo estos días porque el cohete español Miura 1 ha pasado la última prueba antes de su lanzamiento. ¡Ya no queda nada!

No te pierdas el #podcast de hoy en 'Muy al Día’ y descubre más detalles: https://t.co/ycFXxjeBXR"
Tweet,"No es una señal alienígena, sino una prueba enviada desde Marte y capturada por tres telescopios de la Tierra. Puedes ayudar a decodificar el mensaje. https://t.co/wVqpDOdT5w"
Tweet,"Los fascinantes reportajes de 'Muy Interesante' ahora en tus oídos. Escucha nuestro podcast y descubre historias sorprendentes de la ciencia, tecnología, historia y mucho más. https://t.co/DvlDTxLGIz"
Tweet,¿No son las abejas? Un nuevo estudio ha descubierto que hay otro insecto mucho más eficiente a la hora de polinizar: la polilla. https://t.co/7Tvm4GzmG7
Retweet,"📚 Hoy tienes una cita con Miguel Ángel Sabadell (@cienciadetuvida) en la Feria del Libro de Madrid, donde firmará sus libros a partir de las 17:00 horas.

📍 Parque de El Retiro (Madrid), Caseta 141
🗓️ 30/05/2023
🕖 17:00 - 18:00 horas https://t.co/rKsqKaS3nF"
Tweet,Descubre cómo un solo año cambió la historia con el podcast de 'Muy Historia' sobre el icónico 1968 y sus impactantes sucesos. https://t.co/1zb4eKNBeR
Tweet,"""Cuando se tienen muchas cosas que meter en él, el día tiene cien bolsillos"", decía el filósofo alemán Friedrich Nietzsche. Estas son algunas de sus mejores frases. https://t.co/at1TaRTg1K"
Tweet,"Un estudio demuestra que los animales que tuvieron traumas en la infancia vivieron menos. Sin embargo, las relaciones sociales fuertes pudieron revertir esto. https://t.co/Sj2sdgOgui"
Tweet,"¿Los peces existen? Desde un punto de vista evolutivo, el grupo conocido como 'peces' no es válido. Aunque la trucha, la sardina, el tiburón y la lamprea son reales, el concepto de 'peces' como categoría evolutiva no se sostiene. 

Te contamos por qué👇

https://t.co/5XL5bZEMrW"
Tweet,"Desde pequeñas acciones cotidianas hasta cambios importantes en nuestro estilo de vida, hay muchas formas de reducir nuestra huella de carbono y ayudar a proteger el medio ambiente. https://t.co/hm8kQvTHKk"
Tweet,El experimento llevado a cabo con ratones ofrece una pista intrigante sobre la tecnología que podría ser la clave para los viajes espaciales a largo plazo en el futuro. https://t.co/KLNDlUrqtQ
Tweet,"Esta guía, publicada por la editorial Pinolia, contiene multitud de información, consejos y técnicas de adiestramiento en positivo y es un libro básico para todas aquellas personas que quieran educar a su cachorro, cuidarle y hacerle feliz. https://t.co/6ldtfdmv0R"
Tweet,El auge cultural y artístico de Atenas atrajo como un faro a los mejores artistas de la época. https://t.co/qlnUxjEKvN
Tweet,"¿Sabías que el deporte canino mejora la convivencia y el bienestar de tu perro? No te pierdas esta entrevista realizada por Diego Lorenzo a Marcos González González, Campeón en España Copa IGP 2023 RSCE. 

👉 Te lo cuenta @adoptak https://t.co/in3hNM8rKn"
Tweet,La NASA muestra en animación los agujeros negros más colosales del universo https://t.co/656RrHt7Ev
Tweet,"Uno de los mitos más persistentes en astronomía es que las estrellas que vemos en el cielo llevan mucho tiempo muertas y que las vemos brillar porque su luz tarda muchísimo tiempo en alcanzarnos, pero esto no es así. https://t.co/pwL1SIFJOO"
Tweet,Un pequeño fósil del Jurásico es el ancestro común de más de 10.000 especies que siguen vivas. https://t.co/xUgZJw51MF
Tweet,La puja por los fósiles en las casas de subastas alcanza cada vez cifras mayores. Millones de dólares con los que las instituciones científicas no pueden competir. Todo un lastre para la paleontología. https://t.co/38UnwdHRGN
Tweet,El 30 % de las visitas a la red corresponde a bots maliciosos que comprometen la seguridad informática. https://t.co/op2u6kh3VH
Tweet,"Los turismos 'grandes' de Opel ya no producen emisiones. Del Opel Astra Sports Tourer híbrido enchufable hasta el monovolumen Opel Combo‑e Life, y el confortable 'e-lounge sobre ruedas', el Opel Zafira-e Life, la marca de Rüsselsheim ofrece modelos para... https://t.co/7clQVUBLo5"
Tweet,¿Qué nos hace humanos? Mira lo que han descubierto: https://t.co/W3Pe70I2bZ
Tweet,"Creador de la momificación y señor de los cementerios, el dios perro Anubis velaba por los difuntos en el antiguo Egipto. https://t.co/RvKlkO9yal"
Tweet,"El interior también llama la atención por una serie de mejoras en la ergonomía, resultado de la filosofía centrada en el ser humano de Mazda https://t.co/5G18UaGLp7"
Tweet,"Aunque solemos pensar que las frutas como las naranjas o los limones son naturales, en realidad, desde una perspectiva de definiciones, no lo son. https://t.co/D0dNzt91dV"
Tweet,"Hace medio siglo los científicos descubrieron que el mundo no se comporta de forma tan predecible como sugiere la física clásica. Desde el clima hasta las poblaciones de animales y los latidos de nuestro corazón, el caos gobierna el universo. https://t.co/p4f9NziSzu"
Tweet,El campo semántico alrededor de la crisis climática antropogénica se ha enriquecido con toda una serie de neologismos de los que apenas distinguimos su significado. https://t.co/mYyUvEEQeI
Tweet,"La invasión de la Unión Soviética fue definitiva para el final de Hitler, que ya acumulaba graves errores que acabaron con la Alemania nazi. https://t.co/79pA60MM6U"
Tweet,La Internet oscura o Dark web ha sido el campo de pruebas para entrenar esta nueva herramienta de IA. https://t.co/A1P3JqsoeD
Tweet,Este filósofo presocrático afirmaba que el fundamento de todo está en el cambio incesante. https://t.co/xqcyxS44Yh
Tweet,“La estatua imposible” combina los estilos de cinco escultores que no vivieron en la misma época. https://t.co/KkseleCA1d
Tweet,"Un huevo de tiburón encontrado en Australia revela una nueva especie, Apristurus ovicorrugatus, previamente identificada erróneamente y almacenada en una colección durante décadas. https://t.co/ffvQShBKRc"
Tweet,La representación realista podría ayudar a predecir problemas antes de la construcción. También a reducir costes. https://t.co/KDQdssanam
Tweet,Las modificaciones faciales causadas por el bótox pueden influir tanto en la forma en que nuestras mascotas interpretan nuestras emociones como en nuestra propia percepción emocional. https://t.co/1HxVyzhDss
Tweet,"La mente brillante de Nikola Tesla iluminó el mundo con sus inventos revolucionarios y su visión futurista. Sus contribuciones a la ciencia y tecnología siguen inspirando e impactando nuestras vidas hoy en día.

👉 Descubre más sobre él en este artículo: https://t.co/bRPPGbd3Pp https://t.co/pSfhA1F4Nm"
Tweet,"A lo largo de miles de años, la estrecha relación entre humanos y perros ha llevado a la hipótesis de que las habilidades sociocognitivas de los perros han evolucionado de manera convergente, volviéndose sorprendentemente similares a los humanos. https://t.co/9Lf0EWM0aE"
Tweet,"🔴 La mayor caída se ha encontrado entre los jóvenes de 18 a 22 años, según un reciente estudio en Estados Unidos. https://t.co/bjwqhFSEM3"
Tweet,¿Puede la IA hacer el trabajo de un historiador? Entrevistamos a ChatGPT en busca de respuestas para el escenario de incertidumbres que nos plantea esta revolución tecnológica.  https://t.co/3HRnfceZN0
Tweet,"Nuestro grupo de referencia nos ayuda a reducir la tensión que nos produce tomar ciertas decisiones difíciles. Además, sentirnos parte de un colectivo nos ayuda a distinguir a nuestros enemigos. https://t.co/lKqOdLpTzh"
Tweet,"El primer caso del mundo de infección por hongos en humanos recuerda a la catástrofe biológica de la ficción 'The Last of Us'.

https://t.co/mBQ1t2667b"
Tweet,"La muerte del universo será lenta pero imparable: dejarán de nacer nuevas estrellas y las viejas morirán, los agujeros negros supermasivos engullirán sus galaxias y empezarán a evaporarse, mientras los protones de todo el universo empiezan a desintegrar... https://t.co/ZeI59RijmP"
Tweet,"Las flores siempre han llamado la atención del ser humano, y el origen de su coloración se encuentra en el proceso evolutivo. https://t.co/D3wIsfTxUG"
Tweet,"La vida es algo frágil y podría desaparecer de multitud de formas diferentes. Aquí os contamos las cuatro amenazas astrofísicas más importantes a las que se enfrenta el planeta Tierra, desde catástrofes provenientes de nuestro sistema solar hasta ... https://t.co/jrec1zjvow"
Tweet,Renault vuelve a conectar con su historia inspirándose en la fuerza del legendario Caudron Rafale para encarnar la imagen de alta gama de la marca https://t.co/YNuwInSuT1
Tweet,"Minucioso hasta el último día, llegó a aprobar en vida su propio ataúd. https://t.co/WqG3wetcte"
Tweet,"¡Descubren un insecto gigante de la época de los dinosaurios! Un emocionante hallazgo realizado por el investigador de la Universidad de Arkansas, Michael Skvarla, revela la verdadera identidad de un insecto descubierto en 2012 en un Walmart en Arkansas... https://t.co/nNK1GLm3iX"
Tweet,¿Fue Roma realmente el mayor imperio que jamás haya existido en la historia de la humanidad? https://t.co/5EpnU0ZjRZ
Tweet,"¿Sabías que agujeros en la corona solar del tamaño de Neptuno permiten que millones de toneladas de partículas cargadas escapen del Sol cada segundo?

Descubre qué efecto tiene en la Tierra en este artículo 👇

https://t.co/EcirzJpBPJ"
Tweet,Hay que tener mucha precaución ya que el calor tiene efectos directos en el comportamiento de los conductores y sus capacidades psicofísicas; así como en algunos elementos del coche https://t.co/cr4dzQ793W
Tweet,"¿Te consideras ‘lunático´? Ya sabes, de los que dicen que les afecta la luna llena… pues no te pierdas la noticia de hoy en 'Muy al día' https://t.co/dMXvXIN2VN"
Tweet,"La física del siglo XXI se enfrenta a muchos enigmas que esperan resolución en los dos extremos de la escala de distancias, el subatómico y el intergaláctico. Y lo más llamativo es que están interconectados. https://t.co/RLwoA6Afbx"
Tweet,"Mayo es un mes perfecto para disfrutar de una observación nocturna del firmamento. Este mes tenemos un eclipse penumbral de luna, y bastante movimiento entre planetas y constelaciones. https://t.co/H8mUyNQObE"
Tweet,"Como la nueva embajadora de la firma del Léon, la actriz ha sabido mostrar su talento en el cine, la televisión, el teatro y las plataformas digitales, además de lanzarse a retos la creación y la producción https://t.co/tHwYERTIzc"
Tweet,Un equipo de investigación identifica por primera vez la composición de un perfume de época romana. https://t.co/9FoB1HqzAL
Tweet,Los científicos creen que las torres de comunicaciones móviles representarían una forma de localizarnos en nuestro vecindario cósmico. https://t.co/PcQWIyJTAx
Tweet,"Visitar el interior del sistema solar resulta mucho más exigente energéticamente que alejarse del Sol y es, por eso, que visitamos antes Júpiter que Mercurio; o que hemos mandado más misiones al exterior que a su interior. https://t.co/BGxC48cdZf"
Tweet,"Agujeros en la corona solar del tamaño de Neptuno permiten que millones de toneladas de partículas cargadas escapen del Sol cada segundo en forma el viento solar, que alcanza la Tierra chocando contra su campo magnético y formando auroras boreales ... https://t.co/i0OcsaI1G6"
Tweet,"En la carrera por la fecundación, ni el primer espermatozoide en llegar es el victorioso, ni el óvulo es una especie de receptor pasivo; la realidad es bastante más compleja que una simple frase motivacional. https://t.co/3yznaaFQt0"
