type,text
Tweet,"La ciencia a veces resulta 'antintuitiva', como suele decirse de algunos principios de la relatividad especial o de la mecánica cuántica. En esa línea, Mercurio es, contra toda intuición, el planeta más cercano a todos los demás planetas del sistema solar. https://t.co/K5Wk9Z9NN2"
Tweet,¿Qué estudia esta rama de la ciencia? ¿Cuántos campos de estudio existen? Te lo explicamos todo en este artículo. https://t.co/h9RUMq7ly2
Tweet,"Todo el mundo sabe diferenciar un tigre de un león, pero otros grandes félidos no son tan sencillos de distinguir, y cuando un animal es de color pardo con manchas negras, afloran las confusiones. https://t.co/cx4rWjUSe3"
Tweet,"¿Por qué las mujeres matan? La socióloga y criminóloga Victoria Pascual Cortés nos responde en una entrevista exclusiva tras la publicación de su último libro Asesinas (editorial Pinolia), donde explora los motivos detrás de los crímenes cometidos por ... https://t.co/XKtlIRe4lk"
Tweet,"Un icono 'made in Spain' que se ha transformado sin renunciar a conceptos como polivalencia, fiabilidad, robustez y espacio interior. Unas características que están también muy presentes en sus versiones eléctricas, el Citroën ë-Berlingo y el Citroën ... https://t.co/cJCVzI82No"
Tweet,La historia de los apellidos españoles nos cuenta cómo un recurso pasó a ser parte de nuestra identidad. https://t.co/MQncJHZU91
Tweet,Locusta se encargó de envenenar al servicio de Agripina y su hijo Nerón. Está considerada la primera asesina en serie de la historia. https://t.co/EpSOAK833x
Tweet,"En los primeros instantes del universo había tanta materia como antimateria, y ambas deberían haberse aniquilado dejando tras de sí un universo de radiación y nada más. Y sin embargo eso no es lo que observamos, pues nuestro universo está dominado por ... https://t.co/LyPbZzb7p5"
Tweet,"A este ritmo de hundimiento, lugares icónicos como la Gran Manzana desaparecerán para siempre en la 'ciudad que nunca duerme'. https://t.co/8jDKoeAl7Y"
Tweet,"Un equipo de arqueólogos de la Universidad de Zadar ha encontrado un camino de la Edad de Piedra bajo las aguas del Mediterráneo, cerca de la costa de Croacia. Este antiguo camino data de hace 7.000 años y ha sido descubierto en Soline, en el Mar Adriático.  

🧵 https://t.co/NloT1ddILG"
Reply,"El camino estaba construido con placas de piedra cuidadosamente apiladas, con un ancho de aproximadamente 3,6 metros. Estas piedras conectaban el continente con el asentamiento prehistórico, ahora enterrado bajo el lecho marino."
Reply,"Este fascinante hallazgo arqueológico arroja nueva luz sobre la historia de la región y nos acerca aún más a comprender cómo era la vida en el pasado remoto.

Puedes conocer más sobre este impresionante descubrimiento aquí:
https://t.co/zyfozmZXT1"
Reply,"Utilizando la datación por radiocarbono, los investigadores fecharon el camino y el asentamiento alrededor del 4900 a.C., aunque se cree que el camino es aún más antiguo. También se encontraron otros artefactos neolíticos que tienen unos impresionantes 7.000 años de antigüedad."
Reply,"El camino se encuentra a una profundidad de 5 metros, en depósitos de sedimentos en el yacimiento arqueológico sumergido de Soline. Perteneció a una cultura marítima perdida conocida como Hvar, que habitó la zona durante el Neolítico. https://t.co/AyUkfKYRGZ"
Reply,"Los investigadores identificaron una ""estructura extraña"" en imágenes de satélite de las aguas cerca de la isla de Korčula. Al sumergirse en ellas, descubrieron los muros de un antiguo asentamiento que parecía estar conectado a la isla principal por una estrecha franja de tierra."
Tweet,Hoy desgranamos algunas citas del mayor icono de la Revolución Mexicana que apoyó constantemente la reforma agraria. https://t.co/XcwCWUEKoq
Tweet,¿Sabías que es posible vivir sin algunos órganos de tu cuerpo o con parte de ellos? Descúbrelos aquí. https://t.co/QpHI1Jbe7z
Tweet,La criatura viviente más antigua de la Tierra surgió hace 700 millones de años. Evolucionó de los mismos animales primordiales que los humanos. https://t.co/DojZeAdmHl
Tweet,Un nuevo estudio ha descubierto la relación entre la velocidad de movimiento de estos animales y su tamaño. https://t.co/7yPTI97q0N
Tweet,¿Signos de inteligencia artificial general (AGI)? Los investigadores de la compañía de Bill Gates apuntan en esta dirección. https://t.co/RNhZrS8rlJ
Tweet,"Confiesa: ¿eres de siesta? ¿te levantas descansado o te sienta peor?

Así es la perfecta costumbre española según la ciencia:no te pierdas todos los detalles hoy, en 'Muy al Día' #podcast https://t.co/DmM8YD60Yf"
Tweet,"En abril, Alfa Romeo sube hasta la séptima posición del mercado premium español, con 435 matriculaciones y un 3,3% de cuota https://t.co/Mrju2kwdGf"
Tweet,"🧬 ¿Sabías que la primera secuenciación del genoma humano fue solo el comienzo? Descubre el asombroso mundo del pangenoma humano, y cómo permite comprender la diversidad genómica existente en la humanidad. 

🧵 https://t.co/BQGvKCRr2a"
Reply,"6/ Comprender y usar el pangenoma humano abre la puerta a análisis genéticos precisos y avances en medicina, mejorando nuestra capacidad para predecir, diagnosticar y tratar enfermedades, asegurando que todos se beneficien de la investigación genómica y la medicina de precisión."
Reply,"🔴 No te pierdas este fascinante artículo que explora el asombroso mundo del pangenoma humano y su potencial para la investigación biomédica y la medicina de precisión. Sumérgete en la diversidad genética que nos hace únicos:
https://t.co/jaujLMbIWG"
Reply,"5/ Construir este pangenoma fue posible gracias a 47 genomas completos y más de 100 secuencias con variaciones genéticas frecuentes. Pero el Consorcio ahora se propone secuenciar 100 genomas humanos diversos, con el objetivo final de alcanzar 350 genomas."
Reply,"4/ Recientemente, el Consorcio del Pangenoma Humano publicó cuatro artículos en 'Nature', proponiendo el primer pangenoma humano de referencia. Un logro científico que amplía nuestra comprensión de la genética humana y su diversidad."
Reply,"3/ 🧩 El genoma humano de referencia es solo una referencia para una sola persona. Pero el pangenoma es el conjunto de genes que conforman todo un linaje humano. Es el compendio de genomas de la especie, incluyendo no solo las partes comunes, sino sus variaciones y frecuencias."
Reply,"2/ A comienzos del siglo XXI, la secuenciación del genoma humano fue un hito científico sin precedentes. Sin embargo, esa primera secuencia genética, construida como un gigantesco rompecabezas, ya se ha vuelto obsoleta en apenas dos décadas."
Reply,"1/ La humanidad es increíblemente diversa, y aunque compartimos el 99% del ADN, ese 1% restante alberga todas nuestras diferencias. ¡Un solo genoma de referencia no es suficiente para capturar esta riqueza genética!"
Tweet,Muchos amantes de los museos se preguntan si es posible disfrutar de una experiencia cultural junto a su fiel compañero canino. https://t.co/EQeaqdtXUv
Tweet,"Los investigadores pensaban que eran tatuados, pero un estudio expone que fueron marcados como ganado. https://t.co/c4IG3WxzZp"
Tweet,Repasamos las catástrofes naturales que más víctimas y mayor destrucción han causado a su paso. https://t.co/tY5sc5iN6i
Tweet,¿Hacerse el muerto para sobrevivir? Cualquier estrategia de supervivencia es bienvenida para estos insectos. https://t.co/G2rUZU55ZR
Tweet,El ahorro de 24.481 toneladas de CO2 equivale a la capacidad de absorción de 349.729 encinas https://t.co/a6T979mrDp
Tweet,"La influencia griega en la mitología fue difícil de resistir. Zeus y Júpiter, Poseidón y Plutón... repasamos los dioses romanos. https://t.co/8S85A5durG"
Tweet,"Todos aquellos reportajes que siempre te han entusiasmado, ahora te los contamos en formato #podcast. II Guerra Mundial, Grandes enigmas de la #Historia, Antiguas Civilizaciones y mucho más aquí: https://t.co/3FMCfW9DoF"
Tweet,"El fabricante coreano vendió 148.571 unidades en Europa durante el primer trimestre de 2023, un 2,23% más respecto al año pasado https://t.co/qGBCJBnMSB"
Tweet,"El camino data de hace 7.000 años y ha sido encontrado en Soline, frente a la costa de Croacia, debajo del Mar Adriático en el Mediterráneo. https://t.co/Do173SJELT"
Tweet,"A pesar de la creencia popular de que la evolución humana ha llegado a su fin, la ciencia demuestra lo contrario: los humanos seguimos evolucionando, aunque quizás de una manera diferente a lo que algunos imaginan. https://t.co/clzTxGd7zj"
Tweet,¿Sabías que un simple postulado revolucionó toda la geometría tal como la conocemos? https://t.co/7AaLIB0EQm
Tweet,Reptiles de hasta 10 metros fueron los depredadores más temidos antes de la llegada del Tyrannosaurus rex. https://t.co/GhRCwnTLsN
Tweet,"Fiat ha trabajado activamente en el desarrollo de nuevas siluetas y carrocerías, como el Station Wagon a los monovolúmenes más audaces o los vehículos polivalentes, para cubrir la necesidades de las familias https://t.co/iVjEVNwBTC"
Tweet,"Cuando se menciona la palabra “polen"", un porcentaje cada vez más amplio de la población se desasosiega, pensando en los síntomas que les provoca en determinadas épocas del año. ¿Pero sólo sirve para fastidiarnos la existencia? https://t.co/9f4ZtP87oo"
Tweet,"Armstrong, Aldrin y Collins fueron aclamados como grandes estrellas. El gobierno de Franco quiso utilizar la visita para sus intereses políticos. El resultado fue una de las jornadas más pintorescas de la historia de España. https://t.co/3v7mjIJVB5"
Tweet,"El líder nazi fue un artista frustrado. Un pintor mediocre que, sin embargo, tiene obras que se han vendido por cientos de miles de dólares en subastas. Analizamos las dotes artísticas de Adolf Hitler. https://t.co/ZP5wFs0emb"
Tweet,"En la naturaleza menos es más: de manera muy sencilla los animales son capaces de lograr proezas que nosotros, con toda la tecnología que poseemos, somos incapaces de conseguir. https://t.co/hOQQf05Rme"
Tweet,"Un estudio reciente publicado en la revista Science sugiere que las hembras de ciertas especies de peces prefieren a los ""raros"" y seleccionan favorablemente a los peces de otras poblaciones, incluso si tienen patrones de colores comunes, lo que podría ... https://t.co/SZrrhyOJ6c"
Tweet,"La introducción en Europa del Sistema Métrico Decimal no fue fácil y necesitó de una revolución y mucho tiempo para que sucediera. Pero incluso hoy día, los países anglosajones siguen reacios al cambio. https://t.co/uXdBOsR86J"
Tweet,"Antes de que se generalizase el uso del término hospital se utilizaron otros como valetudinaria, bimaristan o nosocomium. https://t.co/LHx3AdIN7J"
Tweet,"Los incontables tentáculos de esta medusa están cargados de veneno. Hasta ahora, había pasado desapercibida para la ciencia. https://t.co/U0j05RWddY"
Tweet,La superficie de la Tierra es cambiante desde el inicio de los tiempos gracias a su actividad tectónica. Hoy repasamos todos esos grandes movimientos de tierra del pasado. https://t.co/iLHentfMgT
Tweet,"La influencia griega en la mitología fue difícil de resistir. Zeus y Júpiter, Poseidón y Plutón... repasamos los dioses romanos. https://t.co/EZGKwvCrU8"
Tweet,"La industrial aeroespacial está viviendo un desarrollo acelerado y se espera que la cantidad de satélites en órbita se sextuplique esta misma década, agravando un problema medioambiental que nos afectará a todos y del que los científicos ya están avisando. https://t.co/CZ0nwEB0QV"
Tweet,"Trenzas, rizos, tintes y recogidos se llevaron en diversos estilos a partir de las tendencias generadas por las influencers del momento. https://t.co/DmVmzYic3J"
Tweet,¡Misterio resuelto! Un nuevo estudio presenta el árbol genealógico de las mariposas marcando su origen en lo que actualmente es América. https://t.co/CyKXgqfqYp
Tweet,"El camino data de hace 7.000 años y ha sido encontrado en Soline, frente a la costa de Croacia, debajo del Mar Adriático en el Mediterráneo. https://t.co/XqLiL4rbGr"
Tweet,"Es uno de los peces de acuario más espectaculares, con más variedades, y más fácil de mantener. https://t.co/3xFP9JKGpG"
Tweet,Nos espera un futuro muy tórrido: hay un 98% de posibilidades de que de aquí a cinco años suframos el año más caluroso jamás registrado. https://t.co/s6FzOzc7kR
Tweet,"¿Sabías que humanos y animales compartimos rasgos de personalidad? Por eso, conocer la personalidad de tu futura mascota antes de llevarla a casa, es fundamental para asegurar una convivencia armoniosa y satisfactoria para ambos. Conoce qué determina la... https://t.co/HpT4tjA1AH"
Tweet,Te mostramos aquellos pueblos pequeños y poco conocidos que destacan por su incomparable belleza. https://t.co/8HSIdpzuQM
Tweet,"¿Debería el cine preocuparse por ser sustituido íntegramente por una IA? Joe Russo, director de Los Vengadores: Endgame, cree que sí. https://t.co/Gr7zkUCTjt"
Tweet,¿Te gusta mirar al cielo? Encontrar constelaciones es muy fácil con un poco de ayuda. Aquí tienes una forma de familiarizarte con sus formas más básicas. https://t.co/soNsDY7E17
Tweet,Cinco relieves antropomorfos del siglo V a. C. reescriben la historia tartésica. https://t.co/jkrfsyFcSW
Tweet,Este fenómeno nunca se había visto antes en el sistema solar y un nuevo estudio concreta este enigmático evento. https://t.co/YdRBjRVzSE
Tweet,¿Fue así como llegó el agua a nuestro planeta Tierra? El cometa ha sido detectado en el cinturón principal de nuestro sistema solar. https://t.co/CM0mRJPNtp
Tweet,"La explosión resultante del nacimiento de un agujero negro a partir de una estrella masiva en sus últimos días ha podido haber provocado la mayor explosión jamás registrada, a causa de un fenómeno conocido como estallido de rayos gamma. https://t.co/GKSkWUPFlM"
Tweet,"¿Por qué China, fuente de inventos cruciales para el avance de la civilización y que llevaba varios siglos de adelanto a Occidente, no se convirtió en la fuerza científica impulsora del mundo? https://t.co/6eEOdvmk8M"
Tweet,La inteligencia artificial CRANK-MS detectó el riesgo de sufrir la enfermedad con una precisión de hasta el 96 %. https://t.co/QMocgeQ7Un
Tweet,Científicos del CSIC han descubierto una relación simbiótica entre ambas especies. Han encontrado escarabajos preservados en ámbar 'cazados' alimentándose de estas plumas. https://t.co/hHDXs8Z3MR
Tweet,Un equipo de científicos ha desarrollado un dispositivo que puede simular hasta 30 olores y podría usarse en una miríada de entornos. https://t.co/rvOVluWh0R
Tweet,"Más allá de cuestiones metafóricas o literarias, el amor es un sentimiento que se fragua científicamente en nuestro cuerpo a partir de la generación de ciertas hormonas, neurotransmisores y procesos químicos. ¿Sabes cuáles son? https://t.co/Z3WH161bjC"
Tweet,¿Es un dinosaurio carroñero o depredador? ¿Qué fuerza tenía la mordedura de un 'T. rex'? ¿Cuál era su esperanza de vida? Respondemos a estas y muchas otras preguntas. https://t.co/MENK2h3w81
Tweet,"De bola de fuego, pasando por una bola de hielo, hasta convertirse en un paraíso rebosante de vida. La de nuestro planeta es una historia cambiante llena de eventos catastróficos, en la que persiste la inexorable lucha de la vida por adaptarse y subsistir. https://t.co/yhV186C6eQ"
Tweet,"¿Nuestro cerebro es capaz de repararse? Si así fuese, ¿podríamos aprovechar este potencial regenerativo durante el envejecimiento o para enfermedades neurodegenerativas? https://t.co/oKjfPkcFeP"
Tweet,"¿Te imaginas por qué el Everest hace ruidos extraños de noche?

Atento, antena, que es posible que la razón te sorprenda.

Escucha nuestro #podcast de hoy en ‘Muy al día’: https://t.co/QU8ecTY7HQ"
Tweet,"El DS 4 Esprit de Voyage abre la temporada primavera-verano de DS Automobiles con un equipamiento exclusivo, tecnológico y lleno de pequeños detalles que invitan al viaje https://t.co/RJx7gDmYQs"
Tweet,Se llama MTG-I1 y es el satélite europeo más potente de Europa. Las primeras vistas de nuestro planeta son sencillamente espectaculares. https://t.co/z6qd2LSczB
Retweet,"Conoce la apasionante historia de Canaris, espía y confidente de Franco. Investigación rigurosa y testimonios directos nos sumergen en el espionaje nazi y su estrecha relación con España.

📚 Disponible en nuestra web y librerías

🔗 https://t.co/4nQ48KtQl4 https://t.co/xoLlpzEOLL"
Tweet,La astrobiología es una ciencia muy joven y marcadamente interdisciplinar que puede traer un gran beneficio a la comunidad científica y a la sociedad haciéndonos cuestionar el lugar que ocupamos en el universo y en el mundo. https://t.co/6BnIAuysmB
Tweet,Las campañas de vacunaciones de adultos de enfermedades como el herpes zóster previenen dolencias y mejoran la calidad de vida. https://t.co/3psmtemGas
Tweet,"El Avenger empaqueta el ADN Jeep en un SUV compacto con una combinación original de capacidad, estilo, funcionalidad y tecnología https://t.co/tmMjb3TgUi"
Tweet,En la mayoría de países no existe regulación para esta tecnología y la Unión Europea está trabajando en un reglamento que parece cada vez más necesario. ¿Qué prohibirá? https://t.co/LxE6gxZIk6
Tweet,"Hacemos un repaso fotográfico por las galaxias más espectaculares que conocemos hasta ahora. ¿Cuál es tu favorita? Las fotos de la NASA son, sin duda, inolvidables. https://t.co/FD5MTI9inV"
Tweet,Un experimento concluye que los hombres tienen mejor olfato que las mujeres a la hora de diferenciar a su perro de otros individuos de su especie. https://t.co/Qnjk1v23Dz
Tweet,Las enfermeras alertan de que la población continúa banalizando enfermedades como la gripe y el herpes zóster. https://t.co/ELOuwFPSyb
Tweet,"Según el exastronauta de la NASA, Charles Duke Jr., la superficie de la Luna huele a pólvora. ¿Imaginas embotellar este olor como perfume? https://t.co/kUYCjZQgEt"
Tweet,"Descubre la historia detrás de una de las fuerzas militares más legendarias de la historia: los Tercios de Flandes, en una entrevista exclusiva con el coordinador del libro Los Tercios de Flandes, recién publicado por la editorial Pinolia. https://t.co/mjSloMvCkZ"
Tweet,"La muda del pelo de los perros es inevitable, pero hay algunas razas que sueltan bastante menos pelo que otras. ¿Quieres saber cuáles son? https://t.co/OMD0ywRbmF"
Tweet,"Todos los países cuentan, en su folklore, leyendas, mitos e historias nada convencionales con los que ponernos los vellos de punta. https://t.co/0NbMMetsJz"
Tweet,Se llama MTG-I1 y es el satélite europeo más potente de Europa. Las primeras vistas de nuestro planeta son sencillamente espectaculares. https://t.co/hkuDSW9WAJ
Tweet,El primer fósil de Tyrannosaurus rex subastado en Europa alcanzó esta cifra. https://t.co/VSxzBa5bRR
Tweet,¿Sabías que nuestra luna es la quinta más grande del sistema solar? ¿Por qué se llama simplemente 'luna'? Te contamos estas y otras curiosidades más sobre nuestro satélite. https://t.co/So7zXoxRuN
Tweet,"El balizamiento, mediante 10 biotopos o arrecifes, de la zona protegida en la que se encuentra la primera montaña marina construida con carbonato cálcico, se convertirá en un parque subacuático único en el mundo https://t.co/gA1zqnE9sS"
Tweet,La sonda espacial Emirates Mars Hope ha sido la protagonista de haber captado estas imágenes tan especiales y cercanas de la luna marciana. https://t.co/6PHcq3g9pu
Tweet,El estudio de Harvard lleva 85 años estudiando lo que nos hace felices a los humanos. https://t.co/JCMTsY8CwN
Tweet,"¿Buscando nombre para tu mascota? Os traemos una buena selección inspirada en la mitología antigua griega, romana, egipcia y nórdica. https://t.co/O5BpByYVih"
Tweet,¿Qué organismo regula el estado de conservación de las distintas especies? ¿En qué datos se basa? ¿Cómo se actualiza la lista de especies amenazadas? https://t.co/wSvQHVacu1
Tweet,"Un estudio sueco relaciona los desplazamientos de más de 3 km con varios problemas de salud, entre ellos el sobrepeso. https://t.co/JWdQU0Er6q"
Tweet,El agujero negro supermasivo M87* es 6.500 millones de veces más grande que el Sol y este hito podría darnos pistas acerca de cómo se alimentan estos gigantes 'invisibles'. https://t.co/mm37S0J1qv
Tweet,"¿Qué huella deja en el genoma la consanguinidad? 

‘Consanguinidad: lazos de sangre fatales’, un reportaje de Muy Interesante que no te puedes perder: https://t.co/iX7TKy7I24"
Tweet,"Un estudio afirma que los astronautas que vayan a Marte deberían ser solo mujeres. ¿Quieres descubrir por qué?

Descubre todos los detalles en nuestro #podcast de hoy en ‘Muy al día’. https://t.co/d346RaGcXd"
Tweet,La vida en Sajonia en la prehistoria. Entre las huellas de elefantes y rinocerontes hay un conjunto de huellas del género humano. https://t.co/V94kHCNkmP
Tweet,¿Sabías que estos marsupiales no tienen glándulas sudoríparas? ¿O que es el animal que duerme más horas al día? Hoy te contamos una miríada de curiosidades sobre estas criaturas tan entrañables. https://t.co/ze13msVhnB
Tweet,En la mayoría de países no existe regulación para esta tecnología y la Unión Europea está trabajando en un reglamento que parece cada vez más necesario. https://t.co/YcPVyWwX9g
Tweet,"Nuestro vecino planeta rojo habría tenido agua líquida hace unos 400.000 años, según sugieren los datos del rover Zhurong. https://t.co/6NqxFlZ8tl"
Tweet,"La humanidad es muy diversa, y aunque compartimos el 99 % del ADN, el 1 % restante encierra todas las diferencias, y un solo genoma de referencia no es suficiente. https://t.co/QnMqYTOuUa"
Tweet,"Evolucionamos tan rápido que nos hemos adelantado a nuestra genética, y esto tiene sus consecuencias. https://t.co/9JWtEiev0U"
Retweet,"Descubre la fascinante cultura íbera en este libro coordinado por Vicente Barba Colmenero. Su vida, sociedad, arte y las tradiciones de estos antiguos pueblos peninsulares. 

Una mirada enriquecedora a una cultura aún por descubrir.

📚 Ya disponible

🔗 https://t.co/Ftn2gJpyRA https://t.co/is0RdmFl4p"
Tweet,"La posibilidad de una evolución ""hacia atrás"", conocida como devolución, ha sido planteada en el ámbito científico desde hace tiempo. https://t.co/nHO8CAxwVY"
Tweet,Las razas modernas desarrolladas en los últimos 150 años tienen cráneos más grandes que los perros antiguos. https://t.co/Xjf3VYVZdK
Tweet,Un auriga nacido en Hispania se convirtió en la mayor estrella de las carreras de cuadrigas. https://t.co/6AzRaSBZjg
Tweet,"Hay muchas incógnitas sobre el origen de la vida en la Tierra —y la posibilidad de que exista en otros planetas—, pero en este río de Huelva se han conseguido algunas respuestas. https://t.co/gSqyE75oSs"
Tweet,"Heritage tiene como misión mantener, restaurar y promocionar este ingente patrimonio histórico a través de espacios de exposición, la búsqueda de automóviles clásicos para su rehabilitación y la conservación de objetos y documentos https://t.co/7d48aBQsG4"
Tweet,Los cazadores de meteoritos están borrando datos cruciales de meteoritos milenarios. https://t.co/rbuZwbShyc
Tweet,Hay rastros humanos en casi todas partes excepto en islas aisladas y cimas de montañas remotas. https://t.co/MqRHTa47kh
Tweet,"¿Cómo es posible que animales con un origen tan distinto como aves, murciélagos y pterosaurios tengan la misma estructura que les permita volar? ¿Y por qué la mayoría de animales marinos tienen un mismo plan corporal, ya sean peces, reptiles o mamíferos? https://t.co/fCXP97XGIS"
Tweet,Los astrónomos han descubierto que Saturno tiene 62 nuevas lunas! Con estas ya suman 145 y... vuelve a ser el rey de los satélites de nuestro sistema solar. https://t.co/RWchpVF79c
Tweet,La nueva ley de protección animal propone crear un listado positivo de especies exóticas permitidas como mascotas. https://t.co/H686N5mV2S
Tweet,"Algunos agujeros negros podrían sobrevivir a una fase anterior al Big Bang, conocida como Big Crunch y formar parte de la materia oscura o servir como semillas para la formación de las galaxias que observamos en el universo actualmente. https://t.co/vJUPpNRCb1"
Tweet,¿Cuál es el origen? No se pueden rastrear a ninguna fuente conocida. Los científicos han confirmado que no están ligados a eventos naturales o artificiales. https://t.co/2F7ycfeEJD
Tweet,"Desde Star Trek hasta Marvel, la mayoría de los extraterrestres de la ficción tienen una apariencia más o menos humana, pero si existe vida inteligente ahí fuera, lo más probable es que tenga otro aspecto. https://t.co/jsSrLYbxHJ"
Tweet,Parece ser que el frío impulsa un mecanismo de eliminación de proteínas perjudiciales. https://t.co/VAAwMe46Xv
Tweet,¿Está tu profesión en riesgo de ser sustituida por una inteligencia artificial? Avanza la revolución de las IA. https://t.co/agCUMPXRTu
Tweet,"Los fascinantes reportajes de 'Muy Interesante' ahora en tus oídos. Escucha nuestro podcast y descubre historias sorprendentes de la ciencia, tecnología, historia y mucho más. https://t.co/KObq4TeRql"
Tweet,"En 1994 comenzaba un programa de investigación de seis años de duración en un conjunto de aceleradores de partículas del CERN, en Ginebra. Consistía en siete experimentos en los que se iban a utilizar iones —átomos que han perdido parte de sus electrone... https://t.co/YGkac0pPfb"
Tweet,"El fabricante español contará con una flota de 24 coches electrificados, que combinan deportividad, eficiencia y la máxima emoción de conducción https://t.co/tdsZBJBumA"
Tweet,Contradice la idea de que todos los mamíferos fueron pequeños y vivieron escondidos en la era de los dinosaurios. https://t.co/qICFARmitO
