type,text
Tweet,"Su nombre es Caryn Majorie, tiene 23 años y ha utilizado la tecnología OpenAI para crear una novia virtual que puedes contratar por 1 dólar el minuto. https://t.co/ko5IfAWwHj"
Tweet,"El programa Artemis de la NASA, y en el que colabora la Agencia Espacial Española, pretende no sólo volver a la Luna sino quedarnos allí estableciendo una base permanente. Después de más de 50 años de abandonarlo, volvemos a nuestro satélite. https://t.co/G0RtcJPS23"
Tweet,"🐶🔍 ¡No te pierdas estas curiosidades fascinantes sobre los perros! 🐾 Descúbrelo de la mano de nuestros amigos de @adoptak y sorpréndete con la inteligencia, lealtad y diversidad de nuestros compañeros peludos. https://t.co/q5gPt8AkF2"
Tweet,"No paramos de oír novedades sobre la IA, pero, ¿para cuándo una regulación?

Descubre todos los detalles en el #podcast de hoy: https://t.co/wXTkbwenyb"
Tweet,"Forjadas en piedra, metal y madera, nuestras ciudades están llenas de impresionantes esculturas. https://t.co/g9INyHI8jD"
Tweet,"El Raval es la invitación a una nueva generación que espera algo mejor: un coche urbano, rebelde y 100% eléctrico https://t.co/l8A1MvmypL"
Tweet,"Los perros saben el tipo de persona que eres. Torpe, nervioso, comprensivo o egoísta. La ciencia ha demostrado cómo los perros pueden identificar nuestras intenciones y actitudes. Pero, ¿con quién se quedarían si pudieran elegir? https://t.co/drrsZu9kvv"
Tweet,"Si bien hay cientos de robots increíbles para elegir a lo largo de la historia, aquí encontrarás a los más importantes y memorables. https://t.co/PhYVpGDZWz"
Tweet,"El beso más antiguo registrado tuvo lugar en Mesopotamia hace 4.500 años, 1.000 años antes de lo que se pensaba. https://t.co/ItEwhCGDD2"
Tweet,¿Cuál es su tamaño? ¿Cuándo consumirá el Sol nuestro planeta? ¿A qué velocidad se mueve? Respondemos a estas y otras preguntas. https://t.co/HuVyIit2BS
Tweet,Contempla la belleza oculta de nuestra estrella gracias a las impresionantes imágenes del telescopio solar Inouye. https://t.co/w0qYXAKGuU
Tweet,"Se conocen decenas de galaxias enanas orbitando alrededor de la Vía Láctea, pero Segue 2 es la más pequeña de ellas y podría ser un ejemplo de satélites de satélites galácticos más antiguos que nuestra propia galaxia. https://t.co/rM9ec2JLt7"
Tweet,¿Qué estudia esta rama de la ciencia? ¿Cuántos campos de estudio existen? Te lo explicamos todo en este artículo. https://t.co/YH8sNbXl2J
Tweet,Es una de las estrellas más brillantes del cielo que está situada en la constelación de Orión y está 'cerca' de su final. https://t.co/oO7lISvdpl
Tweet,Aún le quedan días submarinos pero ya ha conseguido el récord Guinness de permanencia bajo el agua. El protagonista: un ex buzo de la marina de Estados Unidos. https://t.co/s5f3P3hGDE
Tweet,"Sam Altman reconoce que la inteligencia artificial puede tener ciertos riesgos para el ser humano pero defiende que, por ahora, son más los beneficios que los perjuicios. https://t.co/m0Wx1rMWJU"
Tweet,Sumérgete en la fascinante historia del Islam desde sus orígenes hasta la actualidad con el podcast especial de 'Muy Historia'. https://t.co/73Xa9urEp7
Tweet,Los astrónomos que trabajan en el telescopio Gemini North han publicado una imagen espectacular del espacio profundo. https://t.co/2CSPIo6MPq
Tweet,Un equipo de investigadores del MIT ha desarrollado una técnica que usa los reflejos en objetos brillantes para conseguir vistas ocultas. https://t.co/78GgyPCUPB
Tweet,"Todos conocen la gran diferencia entre estos dos animales, pero, aparte de las orejas, hay muchas más: la forma del cuerpo y la cabeza, los colmillos e incluso los dedos. https://t.co/mR21QwbkTz"
Tweet,"La experiencia tendrá lugar en el circuito Ricardo Tormo de Valencia, entre los días 28 y 31 de mayo https://t.co/fRVM6mHCmA"
Tweet,Un equipo de astrónomos afirmó haber visto un agujero negro 'fuera de control'. ¿Qué es exactamente este 'monstruo cósmico' invisible? https://t.co/0utGv2qk5z
Tweet,¿Hacerse el muerto para sobrevivir? Cualquier estrategia de supervivencia es bienvenida para estos insectos. https://t.co/QSJxEvIQMF
Tweet,Un simple cambio hace que el arte moderno se vea con más entusiasmo y positividad. https://t.co/AnZk6k1Lhq
Tweet,"El uso que hace el ser humano de las heces animales tiene una larga tradición, empezando por fertilizante para los campos. Pero también tiene otras muchas aplicaciones. https://t.co/UagTM6Qsmm"
Tweet,¿Qué significa exactamente esta palabra? ¿Cuál es su origen? ¿Es cierto que es un vocablo despectivo? https://t.co/gKSpXdpmiw
Tweet,Podía pesar 500 kilos y medir 3 metros de altura. Un crecimiento demasiado lento pudo ser clave para su extinción. https://t.co/l4Tu3XcTRn
Tweet,Este segmento crece imparable debido a su bajo costo de operación y su impacto ambiental reducido en comparación con los automóviles tradicionales https://t.co/7fJ4TxEUIe
Tweet,Los cetáceos no responden de la misma manera al ruido que hacen los motores de los barcos. https://t.co/VhBuZJJwPz
Tweet,"¿Cuál ha sido el mayor matemático de todos los tiempos? Si preguntásemos a los de la profesión muy probablemente surgirían nombres como Euler, Gauss, Fermat… o Bourbaki. https://t.co/ExTrS9JHeK"
Tweet,La momia del bisonte pertenece a una especie desconocida con más de 8000 años de antigüedad. https://t.co/zb5OowcS5m
Tweet,"El síndrome metabólico aumenta las posibilidades de sufrir enfermedad cardiaca, diabetes y otros problemas de salud. https://t.co/QNTRZ2f5B5"
Tweet,El cerebro humano podría estar equivocándose al calcular el tamaño de los objetos. https://t.co/iOXeIIX2V7
Tweet,"Serpiente marina gigantesca, el Leviatán bíblico encarnaba las fuerzas del caos. https://t.co/8ztg8kEG63"
Tweet,Ateo declarado y abanderado del pesimismo profundo. Las religiones eran para él la metafísica del pueblo. https://t.co/WJMFJ2eQvo
Tweet,Hacer una foto captando una escena y hacer una autofoto tendrían distintos significados. https://t.co/rcEeVQyZt2
Tweet,Este proyecto de ciencia ciudadana está lleno de una sinfonía épica del universo que sí podemos escuchar. No te dejará indiferente. https://t.co/2gGRdqjfgC
Tweet,La carrera espacial fue una guerra incruenta entre las dos grandes potencias que surgieron después de la II Guerra Mundial. Desde el primer momento la antigua Unión Soviética se puso por delante de Estados Unidos. https://t.co/dFW4FY9a4H
Tweet,Ver noticias que hablan sobre la bondad humana tras recibir noticias malas aumenta los sentimientos positivos y hacen que se tenga una mejor percepción de la humanidad. https://t.co/xqXC4KVDUD
Tweet,¿No son las abejas? Un nuevo estudio ha descubierto que hay otro insecto mucho más eficiente a la hora de polinizar: la polilla. https://t.co/JzWLMNKBgH
Tweet,No es ciencia ficción: esta nueva herramienta no invasiva puede traducir pensamientos en palabras escritas. https://t.co/Wm7dSJVPwE
Tweet,"¿Por qué a niños y adolescentes les encanta la pizza y aborrecen la borraja? Al parecer, todo tiene que ver con cierta carrera de armamentos que se lleva dando en la humanidad desde hace millones de años. https://t.co/Fire1jilBm"
Tweet,"Más de 100 años después de que los científicos usaran datos sísmicos para descubrir el núcleo de la Tierra, la tecnología ha sido aplicada ahora a nuestro vecino planeta rojo. https://t.co/MCf2gpPfwW"
Tweet,"Un equipo de científicos escanea y crea un modelo en 3D del Titanic por primera vez. Descubre cómo se ve actualmente el emblemático buque.

https://t.co/BOAfeP28J4"
Tweet,"La ciencia a veces resulta 'antintuitiva', como suele decirse de algunos principios de la relatividad especial o de la mecánica cuántica. En esa línea, Mercurio es, contra toda intuición, el planeta más cercano a todos los demás planetas del sistema solar. https://t.co/DAm4WgTxSU"
Tweet,"Todo el mundo sabe diferenciar un tigre de un león, pero otros grandes félidos no son tan sencillos de distinguir, y cuando un animal es de color pardo con manchas negras, afloran las confusiones. https://t.co/yZfMndXde1"
Tweet,"¿Por qué las mujeres matan? La socióloga y criminóloga Victoria Pascual Cortés nos responde en una entrevista exclusiva tras la publicación de su último libro Asesinas (editorial Pinolia), donde explora los motivos detrás de los crímenes cometidos por ... https://t.co/AafzT9Ask1"
Tweet,La historia evolutiva de la especie humana está intrínsecamente ligada a su habilidad para adaptarse a diversos entornos. https://t.co/PePY6abtb2
Tweet,"Un icono 'made in Spain' que se ha transformado sin renunciar a conceptos como polivalencia, fiabilidad, robustez y espacio interior. Unas características que están también muy presentes en sus versiones eléctricas, el Citroën ë-Berlingo y el Citroën ... https://t.co/Z4qyVko3mm"
Tweet,OpenAI ha elaborado un estudio en el que analiza cómo impactarán sus modelos de IA en el mercado laboral. https://t.co/kB1zAQDJHe
Tweet,¿Sabías que los apellidos tal y como los entendemos hoy se usan desde el siglo IX para identificar a las personas? Conoce su evolución y significado en España. #genealogía #historia https://t.co/zJg9YjqRFk
Tweet,Locusta se encargó de envenenar al servicio de Agripina y su hijo Nerón. Está considerada la primera asesina en serie de la historia. https://t.co/KrieUweHbC
Tweet,La verdad detrás de la imagen de Cleopatra: ¿cómo era realmente la última reina de Egipto? https://t.co/XB1niEstfO
Retweet,"🔴 A partir de mañana viernes 26 de mayo tienes una cita con nuestros autores en la Feria del Libro de Madrid (@FLMadrid), quienes estarán en la caseta 141 firmando sus libros. ¿Quieres descubrir cuándo y a qué hora? Toma nota 🖊️🧵 https://t.co/gF35Ctg400"
Tweet,Se trata del fósil de reptil marino más antiguo y mejor conservado de todo el sureste de España. https://t.co/gbUcrMdcn6
Tweet,"En los primeros instantes del universo había tanta materia como antimateria, y ambas deberían haberse aniquilado dejando tras de sí un universo de radiación y nada más. Y sin embargo eso no es lo que observamos, pues nuestro universo está dominado por ... https://t.co/UvSs5wREPn"
Tweet,Hoy desgranamos algunas citas del mayor icono de la Revolución Mexicana que apoyó constantemente la reforma agraria. https://t.co/3I3tmZk2GA
Tweet,"¿Te atreverías a pasar cien días bajo el agua?

¿Qué tal vas de CI? Sentimos decirte que el cociente intelectual está descendiendo por primera vez en casi un siglo.

Pero no todo está perdido: no te pierdas todos los detalles hoy, en 'Muy al Día' #podcast  https://t.co/U2jy86Afow"
Tweet,¿Sabías que es posible vivir sin algunos órganos de tu cuerpo o con parte de ellos? Descúbrelos aquí. https://t.co/yWowRWM4og
Tweet,La criatura viviente más antigua de la Tierra surgió hace 700 millones de años. Evolucionó de los mismos animales primordiales que los humanos. https://t.co/sC0R42gSVQ
Tweet,Uno de los fundadores de DeepMind cree que los buscadores tal y como los conocemos hoy no existirán en el futuro. https://t.co/UBNpA1hBu5
Tweet,¿Signos de inteligencia artificial general (AGI)? Los investigadores de la compañía de Bill Gates apuntan en esta dirección. https://t.co/ADobm39yhx
Tweet,"En abril, Alfa Romeo sube hasta la séptima posición del mercado premium español, con 435 matriculaciones y un 3,3% de cuota https://t.co/R0M9h6oJFr"
Tweet,Los astrónomos están buscando un noveno planeta que podría existir dentro del sistema solar. https://t.co/juiRaN3nT3
Tweet,Muchos amantes de los museos se preguntan si es posible disfrutar de una experiencia cultural junto a su fiel compañero canino. https://t.co/tdzQYjnfZH
Tweet,El reinado más corto de la historia apenas superó los 20 minutos. https://t.co/f6EIwJA3tq
Tweet,"¿Te has preguntado alguna vez por qué te enamoras de ciertas personas? Un nuevo estudio ha averiguado la razón por la que lo hacemos. Te lo contamos en este artículo ❤️👇

https://t.co/HbyVRqAYn7"
Tweet,"En la actualidad, el SeatArona es el modelo líder de ventas en el mercado español, y el Ibiza y el Ateca están en el Top 10 https://t.co/4H2s0Awxgw"
Tweet,"Los investigadores pensaban que eran tatuados, pero un estudio expone que fueron marcados como ganado. https://t.co/7Nv0T1twxi"
Tweet,¿Hacerse el muerto para sobrevivir? Cualquier estrategia de supervivencia es bienvenida para estos insectos. https://t.co/yyVHpRnXMo
Tweet,"Este mes en Muy Interesante: Descifrando el universo 

👉 MATERIA OSCURA ¿Y SI NO EXISTIERA? 
👉 EL ASOMBROSO PODER DE LOS HONGOS 
👉 MISTERIOS ASTRONÓMICOS 

Todo esto y más en el nuevo número de Muy Interesante. ¡Ya a la venta!

🔴 Consíguelo ya en https://t.co/QYMNsyEWxP https://t.co/w60tONyY30"
Tweet,"🤔 ¿Sabías que los primeros casos documentados de personas que padecían esclerosis múltiple se remontan al siglo XII y XIV? Según algunos estudios, los vikingos podrían haber tenido relación. Conoce más sobre esta enfermedad neurológica 👇 ... https://t.co/6CalpkiAUA"
Tweet,El ahorro de 24.481 toneladas de CO2 equivale a la capacidad de absorción de 349.729 encinas https://t.co/KhHZvRjWIt
Tweet,"Los mundos marinos podrían ser aún más comunes en el sistema solar exterior de lo que se pensaba anteriormente. Ponemos los ojos en Miranda, Ariel, Umbriel, Titania y Oberón. https://t.co/98DgrMyP9m"
Tweet,"La influencia griega en la mitología fue difícil de resistir. Zeus y Júpiter, Poseidón y Plutón... repasamos los dioses romanos. https://t.co/aiCIsNUo9j"
Tweet,"Todos aquellos reportajes que siempre te han entusiasmado, ahora te los contamos en formato #podcast. II Guerra Mundial, Grandes enigmas de la #Historia, Antiguas Civilizaciones y mucho más aquí: https://t.co/3FMCfW9DoF"
Tweet,"El fabricante coreano vendió 148.571 unidades en Europa durante el primer trimestre de 2023, un 2,23% más respecto al año pasado https://t.co/0SZj09o3SR"
Tweet,"En la naturaleza menos es más: de manera muy sencilla los animales son capaces de lograr proezas que nosotros, con toda la tecnología que poseemos, somos incapaces de conseguir. https://t.co/NzeOnWJWUj"
Tweet,"Cuando se menciona la palabra “polen"", un porcentaje cada vez más amplio de la población se desasosiega, pensando en los síntomas que les provoca en determinadas épocas del año. ¿Pero sólo sirve para fastidiarnos la existencia? https://t.co/P7k5PLnaiK"
Tweet,Reptiles de hasta 10 metros fueron los depredadores más temidos antes de la llegada del Tyrannosaurus rex. https://t.co/ln3FqC3V89
Tweet,"Armstrong, Aldrin y Collins fueron aclamados como grandes estrellas. El gobierno de Franco quiso utilizar la visita para sus intereses políticos. El resultado fue una de las jornadas más pintorescas de la historia de España. https://t.co/ANdYTLlnUf"
Tweet,"El líder nazi fue un artista frustrado. Un pintor mediocre que, sin embargo, tiene obras que se han vendido por cientos de miles de dólares en subastas. Analizamos las dotes artísticas de Adolf Hitler. https://t.co/w7R1htBzJ9"
Tweet,"Fiat ha trabajado activamente en el desarrollo de nuevas siluetas y carrocerías, como el Station Wagon a los monovolúmenes más audaces o los vehículos polivalentes, para cubrir la necesidades de las familias https://t.co/OkfkkPjEYF"
Tweet,"Un estudio reciente publicado en la revista Science sugiere que las hembras de ciertas especies de peces prefieren a los ""raros"" y seleccionan favorablemente a los peces de otras poblaciones, incluso si tienen patrones de colores comunes, lo que podría ... https://t.co/foZdVEU3IC"
Tweet,"La introducción en Europa del Sistema Métrico Decimal no fue fácil y necesitó de una revolución y mucho tiempo para que sucediera. Pero incluso hoy día, los países anglosajones siguen reacios al cambio. https://t.co/tNswzpHjZo"
Tweet,La superficie de la Tierra es cambiante desde el inicio de los tiempos gracias a su actividad tectónica. Hoy repasamos todos esos grandes movimientos de tierra del pasado. https://t.co/Ew2UjKBV1T
Tweet,"La industrial aeroespacial está viviendo un desarrollo acelerado y se espera que la cantidad de satélites en órbita se sextuplique esta misma década, agravando un problema medioambiental que nos afectará a todos y del que los científicos ya están avisando. https://t.co/I3rmQzxzwy"
Tweet,Muchas veces elegimos parejas que comparten nuestros mismos gustos. Un nuevo estudio ha averiguado la razón por la que lo hacemos. https://t.co/n2oP1cb2Xy
Tweet,"Trenzas, rizos, tintes y recogidos se llevaron en diversos estilos a partir de las tendencias generadas por las influencers del momento. https://t.co/GuOlpIi4Gu"
Tweet,"El camino data de hace 7.000 años y ha sido encontrado en Soline, frente a la costa de Croacia, debajo del Mar Adriático en el Mediterráneo. https://t.co/0YXcUan6Re"
Tweet,Paleontólogos españoles han nombrado un gigantesco dinosaurio depredador de hace 127 millones de años. https://t.co/jbt56tM4cH
Tweet,"El chatbot ya es una aplicación oficial para iPhone, pero no para Android. Si quieres saber cómo instalarla en tu móvil, te explicamos cómo. https://t.co/KAmXNitSCn"
Tweet,Es una de las estrellas más brillantes del cielo que está situada en la constelación de Orión y está 'cerca' de su final. https://t.co/AdRXpzJrnp
Tweet,Descubre cómo los avances en genética están revolucionando la forma en que cuidamos la salud de nuestros perros. https://t.co/qRig7QJ1mi
Tweet,"Es uno de los peces de acuario más espectaculares, con más variedades, y más fácil de mantener. https://t.co/E5IVM4L2We"
Tweet,"¿Sabías que humanos y animales compartimos rasgos de personalidad? Por eso, conocer la personalidad de tu futura mascota antes de llevarla a casa, es fundamental para asegurar una convivencia armoniosa y satisfactoria para ambos. Conoce qué determina la... https://t.co/QMNkHE8Xg5"
Tweet,La idiosincrasia epidemiológica de esta enfermedad la convierta en una candidata excepcional para explicar la maldición de Odín. https://t.co/EmvQA3We2g
Tweet,"Como suele decirse en los libros de cocina, las salsas, esos líquidos que acompañan a los ingredientes principales de un plato, se utilizan para realzar el sabor, ya sea amplificándolo, por contraste o complementándolo. https://t.co/khBFmZoDky"
Tweet,"¿Cuál es la clave para ser feliz? Albert Einstein lo explicó en solo 13 palabras...

¿Quieres saber cuáles son? Descúbrelas en el siguiente artículo 👇 https://t.co/DHe70DCM9w"
Tweet,¿Te gusta mirar al cielo? Encontrar constelaciones es muy fácil con un poco de ayuda. Aquí tienes una forma de familiarizarte con sus formas más básicas. https://t.co/39ahrRh0NE
Tweet,"¿Sabías que existirían planetas que orbitan alrededor de agujeros negros supermasivos? Un grupo de investigadores japoneses ha propuesto la existencia de los ""blanetas"".  

Te lo contamos en este 🧵 https://t.co/ZlgRlrBBER"
Reply,Detectarlos es difícil debido a que las técnicas de detección de exoplanetas no son lo suficientemente sensibles para identificar planetas miles de millones de veces menos masivos que el agujero negro. La radiación intensa y el entorno violento complican aún más su observación.
Reply,"Si quieres adentrarte en este fascinante tema y conocer más sobre los blanetas, te invitamos a leer el artículo completo en el siguiente enlace:

https://t.co/AdNG0c4UbT"
Reply,Estos planetas gigantes estarían ubicados a años luz del agujero negro central y su formación sería muy diferente a la de los planetas convencionales. Pero su observación y estudio es un verdadero desafío.
Reply,"Los discos de gas que se forman alrededor de ellos podrían ser el lugar de origen de estos enigmáticos blanetas. Comenzarían como diminutas partículas de polvo y, a medida que colisionan y se adhieren entre sí, crecerían hasta adquirir tamaños similares al de la Tierra."
Reply,"Ahora, los investigadores sugieren que también podrían existir miles de planetas alrededor de agujeros negros supermasivos. Estos agujeros negros se encuentran en el centro de muchas galaxias y emiten enormes cantidades de energía."
Reply,"La diversidad de exoplanetas descubiertos ha sido asombrosa. Desde lunas diminutas hasta gigantes más masivos que Júpiter, e incluso supertierras similares a la nuestra. Han sido hallados alrededor de diferentes estrellas, incluyendo enanas rojas y sistemas estelares múltiples."
Tweet,"El fósil, exportados ilegalmente en los años 90, regresa a su país de origen, abriendo la puerta de la recuperación de material procedente del expolio. https://t.co/LxaJEip39i"
Tweet,"Delia Akeley logró su hazaña en solitario. En 1925 inició un viaje de meses de duración, convivió con tribus africanas y superó innumerables peligros. https://t.co/ZgzQ49Gy5g"
Tweet,"La explosión resultante del nacimiento de un agujero negro a partir de una estrella masiva en sus últimos días ha podido haber provocado la mayor explosión jamás registrada, a causa de un fenómeno conocido como estallido de rayos gamma. https://t.co/LCOynF3wJ0"
Tweet,La inteligencia artificial CRANK-MS detectó el riesgo de sufrir la enfermedad con una precisión de hasta el 96 %. https://t.co/nhLSaiSEbP
Tweet,El científico recomendaba una vida sencilla y una actitud curiosa. https://t.co/CL53bbn0Vx
Tweet,"Desde la diosa egipcia Bastet hasta el león como emblema de la casa Lannister en Juego de Tronos. Los grandes felinos han sido parte de nuestra cultura durante muchos siglos. Pero, ¿sabías que el tigre y el león no son realmente felinos? Descubre por qué 🧵 https://t.co/YgCJlmSqRt"
Reply,"Por otro lado, los panterinos de la subfamilia Pantherinae incluyen al león, leopardo, jaguar, leopardo de las nieves y, por supuesto, al tigre. Estos animales son félidos de tamaño mediano a grande y tienen la capacidad de rugir."
Reply,"¿Quieres saber más sobre los fascinantes detalles de los felinos y los panterinos? Sigue leyendo el siguiente artículo y amplía tus conocimientos sobre estos impresionantes animales.

https://t.co/xwg3X0j9dk"
Reply,"Los felinos de la subfamilia Felinae son animales de tamaño pequeño o mediano, como el puma. Comparten un ancestro común y ronronean en lugar de rugir."
Reply,"Pero el tigre no es un felino. La clasificación taxonómica y filogenética nos ayuda a entenderlo. La familia Felidae tiene la subfamilia Felinae para los verdaderos felinos, mientras que tigres y leones pertenecen a la subfamilia Pantherinae, conocidos como panterinos. https://t.co/BIwYA2Sfpk"
Reply,"Los antiguos egipcios domesticaron a los gatos hace más de cinco mil años, mostrando la fascinación de la humanidad por los felinos. Estos animales están presentes en mitologías antiguas y tienen una presencia importante en la cultura."
Tweet,Un equipo de científicos ha desarrollado un dispositivo que puede simular hasta 30 olores y podría usarse en una miríada de entornos. https://t.co/DsOWATtJcj
Tweet,"¿Te atreverías a pasar cien días bajo el agua?

Este científico estadounidense ha aceptado el reto como parte de un estudio de la NASA.

Escucha nuestro #podcast de hoy en ‘Muy al día’: https://t.co/kj9IPPDKRT"
Tweet,"Uno de los grandes sueños del ser humano es volar, pero la fuerza de la gravedad se empecina en mantenernos pegados a la Tierra. ¿Pero y si hubiera alguna forma de apantallar esa ladina fuerza? https://t.co/VaXXAkBDwY"
Tweet,Paleontólogos españoles han nombrado un gigantesco dinosaurio depredador de hace 127 millones de años. https://t.co/Knna2UZD3X
Tweet,¿Es un dinosaurio carroñero o depredador? ¿Qué fuerza tenía la mordedura de un 'T. rex'? ¿Cuál era su esperanza de vida? Respondemos a estas y muchas otras preguntas. https://t.co/enoGIXMEr1
Tweet,Es una de las estrellas más brillantes del cielo que está situada en la constelación de Orión y está 'cerca' de su final. https://t.co/UVrrIgDdcK
Tweet,"El camino data de hace 7.000 años y ha sido encontrado en Soline, frente a la costa de Croacia, debajo del Mar Adriático en el Mediterráneo. https://t.co/pUZBZgtRkg"
Tweet,"Alrededor de los agujeros negros supermasivos que ocupan el centro de muchas galaxias se concentran grandes discos de gas y polvo en los que podrían formarse planetas más grandes que la Tierra, tal y como han propuesto investigadores japoneses. Estos ... https://t.co/bWXLjagE88"
Tweet,Muchos animales de aspecto terrorífico nunca atacan a los seres humanos ni a otros animales. ¿Sabrías decirnos cuáles? https://t.co/oUIZP5mNvI
Tweet,Se llama MTG-I1 y es el satélite europeo más potente de Europa. Las primeras vistas de nuestro planeta son sencillamente espectaculares. https://t.co/PTq0u7SMVO
Tweet,La astrobiología es una ciencia muy joven y marcadamente interdisciplinar que puede traer un gran beneficio a la comunidad científica y a la sociedad haciéndonos cuestionar el lugar que ocupamos en el universo y en el mundo. https://t.co/p1CbSXSgar
Tweet,"Confirmado. Los científicos han descubierto que la Luna tiene un núcleo sólido, exactamente como la Tierra. https://t.co/C6tyPkPQxY"
Tweet,"Si llevas tiempo dándole vueltas a un problema y no encuentras solución, quizá lo que dice Harvard te saque del atolladero. https://t.co/dT5DqWvELI"
Tweet,"¿Te imaginas descubrir la fascinante historia de una española olvidada en Trípoli en el siglo XIX? Pues prepárate para sumergirte en la lectura del extracto exclusivo del primer capítulo de 'Últimos días en Trípoli' de Mario Garcés, publicado por ... https://t.co/AzG18jF6MA"
Tweet,"La gama Jeep 4xe al completo (Renegade, Compass, Wrangler y el nuevo Grand Cherokee) representa la evolución completa del 4x4 tradicional y ofrece más diversión, más tecnología, más libertad, más capacidad y más sostenibilidad https://t.co/JvmbxUY1Kn"
